{
  "id": "taxon:511145",
  "nombre_cientifico": "Organismo de ejemplo (ficticio)",
  "cepa": null,
  "nombre_comun": null,
  "rango": "strain",
  "linaje": [],
  "dominio": "bacteria",
  "gram": null,
  "proteoma_referencia": null,
  "intereses": ["modelo"],
  "codigo_kegg": null,
  "xrefs": [],
  "procedencia": [
    { "fuente": "ncbi_taxonomy", "id": "511145", "version": "versión-ficticia", "fecha_descarga": "2026-10-01" }
  ]
}
